university,thCode,enCode
จุฬาลงกรณ์มหาวิทยาลัย,จฬ.,
มหาวิทยาลัยเกษตรศาสตร์,มก.,KU
มหาวิทยาลัยขอนแก่น,มข.,KKU
มหาวิทยาลัยเชียงใหม่,มช.,CMU
มหาวิทยาลัยทักษิณ,มทษ.,TSU
มหาวิทยาลัยเทคโนโลยีพระจอมเกล้าธนบุรี,มจธ.,KMUTT
มหาวิทยาลัยเจ้าพระยา,มจพ.,CPU
มหาวิทยาลัยเทคโนโลยีสุรนารี,มทส.,SUT
มหาวิทยาลัยธรรมศาสตร์,มธ.,TU
มหาวิทยาลัยบูรพา,มบ.,BUU
มหาวิทยาลัยพะเยา,มพ.,UP
มหาวิทยาลัยมหาจุฬาลงกรณราชวิทยาลัย,ม.มจร.,
มหาวิทยาลัยมหามกุฏราชวิทยาลัย,มมร.,
มหาวิทยาลัยมหิดล,มม.,MU
มหาวิทยาลัยแม่ฟ้าหลวง,มฟล.,MFU
มหาวิทยาลัยวลัยลักษณ์,มวล.,WU
มหาวิทยาลัยศรีนครินทรวิโรฒ,มศว.,
มหาวิทยาลัยศิลปากร,มศก.,SU
มหาวิทยาลัยสวนดุสิต,มสด.,SDU
มหาวิทยาลัยสงขลานครินทร์,มอ.,
ราชวิทยาลัยจุฬาภรณ์,รจภ,
สถาบันดนตรีกัลยาณิวัฒนา,สกว.,PGVIM
สถาบันเทคโนโลยีพระจอมเกล้าเจ้าคุณทหารลาดกระบัง,สจล.,KMITL
มหาวิทยาลัยราชภัฏกาฬสินธุ์,มกส.,KSU
มหาวิทยาลัยนครพนม,มนพ.,NPU
มหาวิทยาลัยนราธิวาสราชนครินทร์,มนธ.,
มหาวิทยาลัยนเรศวร,มน.,NU
มหาวิทยาลัยมหาสารคาม,มมส.,MSU
มหาวิทยาลัยแม่โจ้,มจ.,
มหาวิทยาลัยรามคำแหง,มร.,RU
มหาวิทยาลัยสุโขทัยธรรมาธิราช,มสธ.,STOU
มหาวิทยาลัยอุบลราชธานี,มอบ.,
สถาบันเทคโนโลยีปทุมวัน,สทป.,
สถาบันบัณฑิตพัฒนบริหารศาสตร์,สพบ.,นิด้า (NIDA)
มหาวิทยาลัยราชภัฏกาญจนบุรี,มรกจ.,
มหาวิทยาลัยราชภัฏกำแพงเพชร,มรภ.กพ.,KPRU
มหาวิทยาลัยราชภัฏจันทรเกษม,มจษ.,CRU
มหาวิทยาลัยราชภัฏชัยภูมิ,มชย.,CPRU
มหาวิทยาลัยราชภัฏเชียงราย,มร.ช.,
มหาวิทยาลัยราชภัฏเชียงใหม่,มร.ชม.,CMRU
มหาวิทยาลัยราชภัฏเทพสตรี,มรท.,TRU
มหาวิทยาลัยราชธานี,มรธ.,RTU
มหาวิทยาลัยราชภัฏนครปฐม,มรน.,NPRU
มหาวิทยาลัยราชภัฏนครราชสีมา,มร.นม.,NRRU
มหาวิทยาลัยราชภัฏนครศรีธรรมราช,มรนศ.,
มหาวิทยาลัยราชภัฏนครสวรรค์,มรนว.,
มหาวิทยาลัยราชภัฏบ้านสมเด็จเจ้าพระยา,มบส.,BSRU
มหาวิทยาลัยราชภัฏบุรีรัมย์,มรภ.บร.,BRU
มหาวิทยาลัยราชภัฏพระนคร,มรภ.พน.,
มหาวิทยาลัยราชภัฏพระนครศรีอยุธยา,มรอย.,
มหาวิทยาลัยราชภัฏพิบูลสงคราม,มรพส.,
มหาวิทยาลัยราชภัฏเพชรบุรี,มรภ.พบ.,PBRU
มหาวิทยาลัยราชภัฏเพชรบูรณ์,มรพช.,
มหาวิทยาลัยราชภัฏภูเก็ต,มรภ.,PKRU
มหาวิทยาลัยราชภัฏมหาสารคาม,มรม.,RMU
มหาวิทยาลัยราชภัฏยะลา,มรย.,YRU
มหาวิทยาลัยราชภัฏร้อยเอ็ด,ม.รอ.,
มหาวิทยาลัยราชภัฏราชนครินทร์,มรร.,RRU
มหาวิทยาลัยราชภัฏรำไพพรรณี,มรรพ.,
มหาวิทยาลัยราชภัฏลำปาง,มร.ลป.,LPRU
มหาวิทยาลัยราชภัฏเลย,มรล.,LRU
มหาวิทยาลัยราชภัฏวไลยอลงกรณ์ ในพระบรมราชูปถัมภ์,มรว.,VRU
มหาวิทยาลัยราชภัฏศรีสะเกษ,มรภ.ศก.,SSKRU
มหาวิทยาลัยราชภัฏสกลนคร,มรสน.,
มหาวิทยาลัยราชภัฏสงขลา,มรภ.สข.,SKRU
มหาวิทยาลัยราชภัฏสวนสุนันทา,มรภ.สส.,
มหาวิทยาลัยรังสิต,มรส.,RSU
มหาวิทยาลัยราชภัฏสุรินทร์,ม.รภ.สร.,
มหาวิทยาลัยราชภัฏหมู่บ้านจอมบึง,มรมจ.,
มหาวิทยาลัยราชภัฏอุดรธานี,มร.อด.,UDRU
มหาวิทยาลัยราชภัฏอุตรดิตถ์,มรอ.,URU
มหาวิทยาลัยราชภัฏอุบลราชธานี,มรภ.อบ.,UBRU
มหาวิทยาลัยเทคโนโลยีราชมงคลกรุงเทพ,มทร.กรุงเทพ,RMUTK
มหาวิทยาลัยเทคโนโลยีราชมงคลตะวันออก,มทร.ตะวันออก,RMUTTO
มหาวิทยาลัยเทคโนโลยีราชมงคลธัญบุรี,มทร.ธัญบุรี,RMUTT
มหาวิทยาลัยเทคโนโลยีราชมงคลพระนคร,มทร.พระนคร,RMUTP
มหาวิทยาลัยเทคโนโลยีราชมงคลรัตนโกสินทร์,มทร.รัตนโกสินทร์,RMUTR
มหาวิทยาลัยเทคโนโลยีราชมงคลล้านนา,มทร.ล้านนา,RMUTL
มหาวิทยาลัยเทคโนโลยีราชมงคลศรีวิชัย,มทร.ศรีวิชัย,RMUTSV
มหาวิทยาลัยเทคโนโลยีราชมงคลสุวรรณภูมิ,มทร.สุวรรณภูมิ,RUS
มหาวิทยาลัยเทคโนโลยีราชมงคลอีสาน,มทร.อีสาน,RMUTI
มหาวิทยาลัยกรุงเทพ,มกท.,
มหาวิทยาลัยกรุงเทพธนบุรี,มกธ.,
มหาวิทยาลัยการจัดการและเทคโนโลยีอีสเทิร์น,มจทอ.,
มหาวิทยาลัยเกริก,ม.กร.,
มหาวิทยาลัยเกษมบัณฑิต,มกบ.,KBU
มหาวิทยาลัยคริสเตียน,ม.ค.ต,
มหาวิทยาลัยหัวเฉียวเฉลิมพระเกียรติ,มฉก.,HCU
มหาวิทยาลัยชินวัตร,มชว.,SIU
มหาวิทยาลัยเซนต์จอห์น,มซจ.,SJU
มหาวิทยาลัยตาปี,มตป.,TPU
มหาวิทยาลัยเทคโนโลยีมหานคร,มทม.,MUT
มหาวิทยาลัยธนบุรี,มธร.,TRU
มหาวิทยาลัยธุรกิจบัณฑิตย์,มธบ.,DPU
มหาวิทยาลัยนอร์ทกรุงเทพ,มนก.,NBU
มหาวิทยาลัยเนชั่น,มนช.,NTU
มหาวิทยาลัยนานาชาติแสตมฟอร์ด,มนชส.,STIU
มหาวิทยาลัยนานาชาติเอเชีย-แปซิฟิก,ม.น.อ.,
มหาวิทยาลัยปทุมธานี,ม.ป.ท.,
มหาวิทยาลัยพายัพ,มพย.,PYU
มหาวิทยาลัยพิษณุโลก,มพล.,PLU
มหาวิทยาลัยฟาฏอนี,มฟน.,FTU
มหาวิทยาลัยฟาร์อีสเทอร์น,ม.ฟ.อ.,
มหาวิทยาลัยภาคกลาง,ม.ภก.,UCT
มหาวิทยาลัยภาคตะวันออกเฉียงเหนือ,ม.ภ.น.,
มหาวิทยาลัยรัตนบัณฑิต,มรบ.,RBAC
มหาวิทยาลัยราชพฤกษ์,มรพ.,RPU
มหาวิทยาลัยวงษ์ชวลิตกุล,มว.,VU
มหาวิทยาลัยเว็บสเตอร์(ประเทศไทย),ม.ว.ท.,
มหาวิทยาลัยเวสเทิร์น,มท.,WTU
มหาวิทยาลัยศรีปทุม,มศป.,SPU
มหาวิทยาลัยสยาม,มส.,SU
มหาวิทยาลัยหอการค้าไทย,มกค.,UTCC
มหาวิทยาลัยหัวเฉียวเฉลิมพระเกียรติ,ม.ฉ.ก.,
มหาวิทยาลัยหาดใหญ่,ม.ญ.,
มหาวิทยาลัยอัสสัมชัญ,มอช.,ABAC
มหาวิทยาลัยอีสเทิร์นเอเชีย,มวอ.,
มหาวิทยาลัยเอเชียอาคเนย์,ม.อ.อ.,
สถาบันกันตนา,สกน.,
สถาบันการจัดการปัญญาภิวัฒน์,สจป.,
สถาบันการเรียนรู้เพื่อปวงชน,สรพ.,LIFE
สถาบันเทคโนโลยีไทย-ญี่ปุ่น,สทญ.,TNI
สถาบันเทคโนโลยียานยนต์มหาชัย,สทม.,MIAT
สถาบันเทคโนโลยีแห่งสุวรรณภูมิ,สทส.,SVIT
สถาบันเทคโนโลยีแห่งเอเชีย,สทอ.,AIT
สถาบันรัชต์ภาคย์,ส.รภ.,
สถาบันวิทยสิริเมธี,สวสธ.,
สถาบันวิทยาการจัดการแห่งแปซิฟิค,ส.ว.ป.,
สถาบันอาศรมศิลป์,อ.ศ.,
วิทยาลัยเฉลิมกาญจนาระยอง,วฉกร,
วิทยาลัยเชียงราย,วชร.,
วิทยาลัยเซนต์หลุยส์,ว.ซล.,
วิทยาลัยเซาธ์อีสท์บางกอก,ซ.อ.บ.,
วิทยาลัยดุสิตธานี,วดธ.,DTC
วิทยาลัยทองสุข,ว.ท.,
วิทยาลัยเทคโนโลยีจิตรลดา,วจด.,
วิทยาลัยเทคโนโลยีพนมวันท์,วทพ.,PCT
วิทยาลัยเทคโนโลยีภาคใต้,วทต.,SCT
วิทยาลัยเทคโนโลยีสยาม,วทส.,STC
วิทยาลัยนครราชสีมา,วนม.,NMC
วิทยาลัยนานาชาติราฟเฟิลส์,วนร.,RIC
วิทยาลัยนอร์ทเทิร์น,วนท.,NTC
วิทยาลัยบัณฑิตเอเซีย,ว.บ.อ.,
วิทยาลัยพิชญบัณฑิต,พญบ,
วิทยาลัยพุทธศาสนานานาชาติ,ว.พ.น.,
วิทยาลัยสันตพล,วสพ.,STC
วิทยาลัยแสงธรรม,วส.,
วิทยาลัยอินเตอร์เทคลำปาง,ว.อ.ท.,
มหาวิทยาลัยนราธิวาสราชนครินทร์,มนร.,PNU
มหาวิทยาลัยอุบลราชธานี,ม.อบ.,UBU
สถาบันเทคโนโลยีปทุมวัน,สปท.,PIT
มหาวิทยาลัยราชภัฏกาญจนบุรี,มร.กจ.,KRU
มหาวิทยาลัยราชภัฏเชียงราย,มร.ชร.,CRRU
มหาวิทยาลัยราชภัฏนครศรีธรรมราช,มร.นศ.,NSTRU
มหาวิทยาลัยราชภัฏนครสวรรค์,มร.นว.,NSRU
มหาวิทยาลัยราชภัฏพระนคร,มรภ.พระนคร,PNRU
มหาวิทยาลัยราชภัฏพระนครศรีอยุธยา,มร.อย.,ARU
มหาวิทยาลัยราชภัฏพิบูลสงคราม,มร.พส.,PSRU
มหาวิทยาลัยราชภัฏเพชรบูรณ์,มร.พช.,PCRU
มหาวิทยาลัยราชภัฏร้อยเอ็ด,มรภ.รอ.,RERU
มหาวิทยาลัยราชภัฏรำไพพรรณี,มร.รพ.,RBRU
มหาวิทยาลัยราชภัฏสกลนคร,มร.สน.,SNRU
มหาวิทยาลัยราชภัฏสวนสุนันทา,มร.สส.,SSRU
มหาวิทยาลัยราชภัฏสุรินทร์,มรภ.สร.,SRRU
มหาวิทยาลัยราชภัฏหมู่บ้านจอมบึง,มร.มจ.,MCRU
สถาบันการอาชีวศึกษาเกษตรภาคเหนือ,สอกน.,NVIA
สถาบันการอาชีวศึกษาเกษตรภาคใต้,สอกต.,SVIA
สถาบันการอาชีวศึกษาเกษตรภาคกลาง,สอกก.,IVACRER
สถาบันการอาชีวศึกษาเกษตรภาคตะวันออกเฉียงเหนือ,สอกฉ.,NEVIA
สถาบันการอาชีวศึกษากรุงเทพมหานคร,สอกท.,IVEB
สถาบันการอาชีวศึกษาภาคเหนือ ๑,สอน. ๑,IVEN 1
สถาบันการอาชีวศึกษาภาคเหนือ ๒,สอน. ๒,IVENR 2
สถาบันการอาชีวศึกษาภาคเหนือ ๓,สอน. ๓,IVEN 3
สถาบันการอาชีวศึกษาภาคเหนือ ๔,สอน. ๔,IVENR 4
สถาบันการอาชีวศึกษาภาคใต้ ๑,สอต. ๑,VEIS 1
สถาบันการอาชีวศึกษาภาคใต้ ๒,สอต. ๒,VEIS 2
สถาบันการอาชีวศึกษาภาคใต้ ๓,สอต. ๓,VEIS 3
สถาบันการอาชีวศึกษาภาคกลาง ๑,สอก. ๑,CVEI 1
สถาบันการอาชีวศึกษาภาคกลาง ๒,สอก. ๒,IVECR 2
สถาบันการอาชีวศึกษาภาคกลาง ๓,สอก. ๓,IVEC 3
สถาบันการอาชีวศึกษาภาคกลาง ๔,สอก. ๔,IVEC 4
สถาบันการอาชีวศึกษาภาคกลาง ๕,สอก. ๕,VEI 5
สถาบันการอาชีวศึกษาภาคตะวันออก,สออ.,EIVT
สถาบันการอาชีวศึกษาภาคตะวันออกเฉียงเหนือ ๑,สอฉ. ๑,IVENE 1
สถาบันการอาชีวศึกษาภาคตะวันออกเฉียงเหนือ ๒,สอฉ. ๒,IVENE 2
สถาบันการอาชีวศึกษาภาคตะวันออกเฉียงเหนือ ๓,สอฉ. ๓,IVENE 3
สถาบันการอาชีวศึกษาภาคตะวันออกเฉียงเหนือ ๔,สอฉ. ๔,IVENE 4
สถาบันการอาชีวศึกษาภาคตะวันออกเฉียงเหนือ ๕,สอฉ. ๕,IVENE 5
โรงเรียนนายร้อยตำรวจ,รร.นรต.,RPCA
โรงเรียนนายร้อยพระจุลจอมเกล้า,รร.จปร.,CRMA
โรงเรียนนายเรือ,รร.นร.,RTNA
โรงเรียนนายเรืออากาศนวมินทกษัตริยาธิราช,รร.นนก.,NKRAFA
สถาบันเทคโนโลยีจิตรลดา,,
วิทยาลัยแพทยศาสตร์พระมงกุฎเกล้า,วพม.,PCM
วิทยาลัยการชลประทาน,วชป.,
สถาบันการบินพลเรือน,สบพ.,CATC
สถาบันการพลศึกษา,สพล.,IPE
สถาบันบัณฑิตพัฒนศิลป์,BPI,
สถาบันพระบรมราชชนก,สบช.,PI
ศูนย์ฝึกพาณิชย์นาวี,MMTC,
จุฬาลงกรณ์มหาวิทยาลัย,จุฬาฯ,CU
มหาวิทยาลัยนวมินทราธิราช,นมร.,NMU
มหาวิทยาลัยมหาจุฬาลงกรณราชวิทยาลัย,มจร,MCU
มหาวิทยาลัยมหามกุฏราชวิทยาลัย,มมร,MBU
มหาวิทยาลัยแม่โจ้,มมจ.,MJU
มหาวิทยาลัยศรีนครินทรวิโรฒ,มศว,SWU
มหาวิทยาลัยสงขลานครินทร์,ม.อ.,PSU
ราชวิทยาลัยจุฬาภรณ์,CRA,
มหาวิทยาลัยการจัดการและเทคโนโลยีอีสเทิร์น,มจท.,UMT
มหาวิทยาลัยเกริก,มกร.,KRU
มหาวิทยาลัยคริสเตียน,มคต.,CTU
มหาวิทยาลัยเฉลิมกาญจนา,มฉน.,CNU
มหาวิทยาลัยนานาชาติเอเชีย-แปซิฟิก,มนอ.,AIU
มหาวิทยาลัยปทุมธานี,มปท.,PTU
มหาวิทยาลัยฟาร์อีสเทอร์น,มฟอ.,FEU
มหาวิทยาลัยภาคตะวันออกเฉียงเหนือ,มภน.,NEU
มหาวิทยาลัยเว็บสเตอร์ (ประเทศไทย),มวท.,WTUT
มหาวิทยาลัยหาดใหญ่,มหญ.,HU
มหาวิทยาลัยอีสเทิร์นเอเชีย,มอท.,EAU
มหาวิทยาลัยเอเชียอาคเนย์,มออ.,SAU
สถาบันกันตนา,สก.,KI
สถาบันการจัดการปัญญาภิวัฒน์,สกป.,PIM
สถาบันวิทยาการจัดการแห่งแปซิฟิค,สวป.,PIMS
สถาบันรัชต์ภาคย์,สรภ.,RPI
สถาบันวิทยสิริเมธี,สวส.,VISTEC
สถาบันอาศรมศิลป์,สอศ.,ASIA
วิทยาลัยเฉลิมกาญจนาระยอง,วฉก.,CKC
วิทยาลัยเชียงราย,ว.ชร.,CRC
วิทยาลัยเซนต์หลุยส์,วซล.,SLC
วิทยาลัยเซาธ์อีสท์บางกอก,ว.ซอบ.,SBC
วิทยาลัยเทคโนโลยีจิตรลดา,วทจด.,CDTC
วิทยาลัยนานาชาติเซนต์เทเรซา,วนซท.,STIC
วิทยาลัยบัณฑิตเอเซีย,วบอ.,CAS
วิทยาลัยพิชญบัณฑิต,วพบ.,PCBC
วิทยาลัยพุทธศาสนานานาชาติ,วพน.,IBC
วิทยาลัยแสงธรรม,วสธ.,STC
วิทยาลัยอินเตอร์เทคลำปาง,วอล.,LIT
มหาวิทยาลัยโยนก,มยน.,YNU
วิทยาลัยศรีโสภณ,ว.ศส.,SSC
มหาวิทยาลัยอีสาน,ม.อส.,ESU
มหาวิทยาลัยเอเชียน,ม.เอเชียน,AsianU
มหาวิทยาลัยรัตนบัณฑิตวิทยาศาสตร์และเทคโนโลยี,มรวท.,RUST
